{
  "id": "phase-p8-research-paper",
  "short": "P8",
  "title": "Research paper",
  "one_line_goal": "Results analysed; paper drafted with every claim checked",
  "summary": "Turn the raw data from the campaigns into analysed results and a draft paper. Every number comes from scripts, every citation is verified, failed experiments are reported, and nothing is called new beyond what you approved. You read the whole paper as its responsible author.",
  "status": "Not started",
  "progress": {
    "done": 0,
    "total": 12
  },
  "step_order": [
    "Paper template",
    "Analysis and figures",
    "Method sections",
    "Results",
    "Related work",
    "Citation check",
    "Reproducibility",
    "Your review"
  ],
  "tasks": [
    {
      "id": "p8.1",
      "title": "Set up the paper project",
      "chain": "We need a paper that builds from day one → set up the LaTeX project with the [proposed ACM template](ref:adr-0017); Claude installs the tools and you click the admin prompt ([who installs](ref:adr-0021)) → writing can start any time.",
      "check": "The empty paper builds to a PDF with no errors; the tool version is recorded.",
      "script": "scripts/verify/p8.1-paper-project.ps1"
    },
    {
      "id": "p8.2",
      "title": "Analyse the campaigns",
      "chain": "Raw data alone proves nothing → run the statistics pipeline on all campaign data and mark each prediction supported, not supported or inconclusive → every verdict links to its analysis.",
      "check": "Every experiment is analysed; a rerun from raw data in a clean setup gives identical output.",
      "script": "scripts/verify/p8.2-analyse-campaigns.ps1"
    },
    {
      "id": "p8.3",
      "title": "Figures and numbers from scripts only",
      "chain": "Hand-typed numbers invite mistakes → every figure, table and number in the paper is generated by a script, with a record of which data made each → every number is traceable.",
      "check": "A check fails if the paper holds a result no script produced; every figure is in the record.",
      "script": "scripts/verify/p8.3-figures-from-scripts.ps1"
    },
    {
      "id": "p8.4",
      "title": "Trace from question to conclusion",
      "chain": "Each conclusion must rest on evidence → build a table linking question → prediction → experiment → raw data → analysis → figure → conclusion, shown in this portal → gaps are visible at a glance.",
      "check": "No empty cell for any reported conclusion; the wiki link checks are clean.",
      "script": "scripts/verify/p8.4-traceability-table.ps1"
    },
    {
      "id": "p8.5",
      "title": "Write method and design sections",
      "chain": "Method and design do not depend on results → write method, architecture, tab-sleeping design and background first → the paper moves on without waiting for data.",
      "check": "The sections build; every claim cites a source; you review them.",
      "script": "scripts/verify/p8.5-write-method-design.ps1"
    },
    {
      "id": "p8.6",
      "title": "Write results and limitations",
      "chain": "Results must come only from finished analysis → after it, write results, security and usability trade-offs, and the limits (energy, process counting, debugging-channel effects, one PC) → no early or unsupported claims.",
      "check": "Every experiment cited in results is analysed; the limits cover every open risk and unsupported measurement.",
      "script": "scripts/verify/p8.6-write-results-limitations.ps1"
    },
    {
      "id": "p8.7",
      "title": "Related work, introduction, abstract",
      "chain": "Claims of novelty must match the approved literature check → write related work from it, then the introduction and abstract last → the paper never overclaims.",
      "check": "Each novelty sentence maps to the approved check; you sign off.",
      "script": "scripts/verify/p8.7-related-work-intro.ps1"
    },
    {
      "id": "p8.8",
      "title": "Verify every citation",
      "chain": "A wrong citation damages trust → a script confirms each reference against its source or its permanent paper ID (DOI) → no unverified or banned references.",
      "check": "The citation check shows zero unresolved entries and none from the do-not-cite list.",
      "script": "scripts/verify/p8.8-verify-every-citation.ps1"
    },
    {
      "id": "p8.9",
      "title": "Report failed experiments too",
      "chain": "Hiding failures is cherry-picking → list every failed or stopped run from the log and run records in the paper or its appendix → the record is honest.",
      "check": "Every failed or stopped run is mentioned in the paper or its appendix.",
      "script": "scripts/verify/p8.9-report-failed-experiments.ps1"
    },
    {
      "id": "p8.10",
      "title": "Reproducibility package",
      "chain": "Others must be able to check our work → package the guide, scripts, setup records and data (or an archive with checksums) with a data licence → anyone can rebuild every figure.",
      "check": "A fresh copy rebuilds all figures from the archived data; the output is saved.",
      "script": "scripts/verify/p8.10-reproducibility-package.ps1"
    },
    {
      "id": "p8.11",
      "title": "AI-use statement",
      "chain": "Venues require disclosure of AI help → finish the AI-use statement to match the chosen venue's policy, with the human authors' responsibility → honest and compliant.",
      "check": "You review and approve it.",
      "script": "scripts/verify/p8.11-ai-use-statement.ps1"
    },
    {
      "id": "p8.12",
      "title": "Integrity check and your review",
      "chain": "The paper is drafted → a checklist confirms no invented facts, versions, measurements, citations or novelty → you read the paper and approve the end of P8.",
      "check": "The checklist is saved, the wiki check is clean, and you approve the end of P8.",
      "script": "scripts/verify/p8.12-integrity-check-review.ps1"
    }
  ],
  "test_gate": {
    "explanation": "Analysis tests pass and a rerun gives identical output → the paper builds → every number comes from a script → every citation checks out → every conclusion traces to data → you read the whole paper and approve.",
    "rows": [
      {
        "check": "Statistics tests",
        "proves": "The analysis code passes its tests."
      },
      {
        "check": "Same input, same output",
        "proves": "Rerunning the analysis gives byte-identical results."
      },
      {
        "check": "Paper builds",
        "proves": "The manuscript compiles to a PDF without errors."
      },
      {
        "check": "Numbers from scripts",
        "proves": "No result in the paper was typed by hand."
      },
      {
        "check": "Citation check",
        "proves": "Every reference is verified; none is banned."
      },
      {
        "check": "Traceability table",
        "proves": "Every conclusion links back to its raw data."
      },
      {
        "check": "Wiki check",
        "proves": "The plan pages are consistent and have no broken links."
      },
      {
        "check": "Your full read",
        "proves": "You stand behind every claim as a human author."
      },
      {
        "check": "Your limits review",
        "proves": "You checked the limitations and the failed experiments."
      },
      {
        "check": "Your sign-off",
        "proves": "You approved the AI-use statement and the reproduction guide."
      }
    ],
    "script": "scripts/gates/p8-gate.ps1"
  },
  "related": [
    "phase-p6-benchmark-harness",
    "phase-p7-lifecycle",
    "adr-0013",
    "adr-0014",
    "adr-0017",
    "adr-0021",
    "exp-lifecycle-policies"
  ],
  "source": {
    "wiki_path": "wiki/phases/phase-p8-research-paper.md",
    "content_hash": "sha256:6df0f3f598cd14de01897d78b360efe9a54d2aebeb0573cfe2393041277442e9"
  }
}
